[
  {
    "tenant_id": "tenant-a",
    "service": "payment-api",
    "environment": "sandbox",
    "region": "us-east-1",
    "timestamp": "2026-06-22T09:00:00Z",
    "source": "prometheus",
    "metric_name": "http_latency_p95_ms",
    "value": 220,
    "unit": "ms",
    "labels": {"window": "baseline", "endpoint": "/checkout"}
  },
  {
    "tenant_id": "tenant-a",
    "service": "payment-api",
    "environment": "sandbox",
    "region": "us-east-1",
    "timestamp": "2026-06-22T10:06:00Z",
    "source": "prometheus",
    "metric_name": "http_latency_p95_ms",
    "value": 2800,
    "unit": "ms",
    "labels": {"window": "current", "endpoint": "/checkout"}
  },
  {
    "tenant_id": "tenant-a",
    "service": "payment-api",
    "environment": "sandbox",
    "region": "us-east-1",
    "timestamp": "2026-06-22T10:06:00Z",
    "source": "prometheus",
    "metric_name": "http_error_rate_percent",
    "value": 12.0,
    "unit": "percent",
    "labels": {"window": "current", "endpoint": "/checkout"}
  },
  {
    "tenant_id": "tenant-a",
    "service": "payment-api",
    "environment": "sandbox",
    "region": "us-east-1",
    "timestamp": "2026-06-22T10:06:00Z",
    "source": "prometheus",
    "metric_name": "redis_timeout_count",
    "value": 340,
    "unit": "count",
    "labels": {"window": "current", "dependency": "redis"}
  }
]
